{
  "schema_version": "gold-v1",
  "id": "gold-037",
  "category": "style_format_only",
  "expected_behavior": "stay_silent",
  "trigger_kind": [
    "none"
  ],
  "severity": "medium",
  "source": {
    "kind": "synthetic",
    "repo": "demo-repo",
    "pr_number": null,
    "pr_url": null,
    "donor_reference": null,
    "reference": "Переименование локальных переменных"
  },
  "code_change": {
    "files": [
      "demopkg/pipeline.py"
    ],
    "summary": "Локальные переменные переименованы для читаемости внутри resize_batch; публичный API и поведение не менялись.",
    "diff": "--- a/demopkg/pipeline.py\n+++ b/demopkg/pipeline.py\n@@ -52,9 +52,9 @@ def resize_batch(images, size, mode=\"bilinear\"):\n-        for i in range(size):\n-            tmp = _pad(images[i])\n-            out.append(_resize(tmp, size, mode))\n+        for idx in range(size):\n+            padded = _pad(images[idx])\n+            out.append(_resize(padded, size, mode))\n",
    "public_api_impact": "none"
  },
  "docs_change": {
    "change_type": "none",
    "target_files": [],
    "target_section": null,
    "human_written_text": null,
    "must_include": [],
    "must_not_include": []
  },
  "lang": "en",
  "labels": [
    "negative",
    "edge",
    "noise"
  ],
  "annotator": {
    "by": "team",
    "reviewed_by": null,
    "date": "2026-10-05"
  },
  "notes": "Ловушка на поверхностный матчинг имён: в diff появляются новые идентификаторы (idx, padded), которых нет ни в коде вокруг, ни в документации. Детектор обязан различать scope: имя локальной переменной не является частью контракта и не требует правки docs.",
  "raw_patch": null
}
