{
  "schema_version": "gold-v1",
  "id": "gold-020",
  "category": "readme_update",
  "expected_behavior": "write_docs",
  "trigger_kind": [
    "behavior_changed",
    "breaking_change"
  ],
  "severity": "low",
  "source": {
    "kind": "synthetic",
    "repo": "demo-repo",
    "pr_number": null,
    "pr_url": null,
    "donor_reference": null,
    "reference": "Правка рекомендаций по установке в существующем руководстве"
  },
  "code_change": {
    "files": [
      "docs/guide/install.md"
    ],
    "summary": "В руководстве рекомендуется ставить пакет без фиксации версии, хотя API ломается в минорных релизах.",
    "diff": "--- a/docs/guide/install.md\n+++ b/docs/guide/install.md\n@@ -7,7 +7,7 @@\n-pip install demopkg\n+pip install \"demopkg==0.4.0\"\n "
  },
  "docs_change": {
    "change_type": "update",
    "target_files": [
      "README.md"
    ],
    "target_section": "Installation",
    "human_written_text": "## Installation\n\nPin the version explicitly. The public API receives breaking changes in minor\nreleases (see `docs/adr/0006-api-stability.md`), so an unpinned `pip install\ndemopkg` can break your code on the next upgrade:\n\n```bash\npip install \"demopkg==0.4.0\"\n```\n\nTo upgrade deliberately, change the pin in `requirements.txt` and re-run the\ntest suite.\n",
    "must_include": [
      "Pin the version",
      "demopkg==0.4.0",
      "breaking changes"
    ],
    "must_not_include": [
      "pip install -U demopkg",
      "latest"
    ]
  },
  "lang": "en",
  "labels": [
    "positive",
    "edge"
  ],
  "annotator": {
    "by": "team",
    "reviewed_by": null,
    "date": "2026-10-05"
  },
  "notes": "Docs-only правка в одном файле должна быть подхвачена и в README — проверка правила 'docs-references пересечение'.",
  "raw_patch": null
}
